{
  "registryVersion": "1.0.0-draft",
  "generatedDate": "2026-06-24",
  "status": "draft-owner-review",
  "mode": "read-only registry; descriptive source-of-truth metadata only. NOT an instruction to move funds, update ENS, create Safe transactions, grant roles, or change runtime config.",
  "description": "Canonical AFI ENS / Safe / vault address registry (draft v1). Maps afidao.eth aliases and related authority/operator accounts to concrete addresses, chains, Safe status, intended roles, and production readiness. Encodes the gap between ENS reality (placeholder Safes) and the intended AFI Settlement v1 vault architecture.",
  "sourceOfTruthRule": "Concrete addresses + chainId + Safe threshold + signer policy are AUTHORITATIVE. ENS names are human-readable aliases ONLY. Contracts MUST NOT resolve ENS dynamically for access control or fund routing.",
  "doctrineRefs": [
    "afi-docs/specs/AFI_SETTLEMENT_V1_DOCTRINE.md",
    "afi-docs/specs/AFI_ENS_SAFE_ADDRESS_REGISTRY_DOCTRINE.md",
    "afi-docs/adrs/ADR-005-ens-aliases-addresses-source-of-truth.md",
    "afi-docs/adrs/ADR-006-unclaimed-rewards-legal-clawback-open.md"
  ],
  "sourceReports": [
    "reports/afi-ens-vault-registry-recon.md",
    "reports/afi-ens-vault-registry.draft.json",
    "reports/afi-vault-architecture-recon.md",
    "reports/afi-onchain-contract-discovery.md",
    "reports/afi-settlement-v1-contradiction-audit-and-cleanup.md"
  ],
  "designRules": [
    "1. Concrete addresses are authoritative.",
    "2. ENS names are aliases only.",
    "3. Contracts must not resolve ENS names dynamically for access control.",
    "4. Placeholder ENS names must not be treated as funded vaults.",
    "5. treasury.afidao.eth must not be treated as the real treasury until owner-approved repointing or registry override exists.",
    "6. The Base Treasury Safe is represented separately from the ENS placeholder treasury.",
    "7. 1-of-1 Safes are marked not production-grade.",
    "8. The legacy (non-canonical) three-letter ENS alias is marked deprecated/stale for AFI governance; the canonical identity is afidao.eth.",
    "9. No entry claims production readiness unless supported by docs and owner approval.",
    "10. Unknown values are represented as null or 'unknown', not guessed."
  ],
  "entries": [
    {
      "id": "afidao-eth-root",
      "name": "AFI DAO Root Identity",
      "ens": "afidao.eth",
      "resolvedAddress": "0x4b02AC8E5551C30c4C92814F63D4576F335E4112",
      "chainId": 1,
      "network": "ethereum-mainnet",
      "accountType": "safe",
      "recommendedRole": "ROOT_DAO_IDENTITY",
      "currentStatus": "active-identity",
      "productionStatus": "not-production",
      "isCanonical": true,
      "isPlaceholder": false,
      "isRuntimeAuthority": false,
      "isFundedVault": false,
      "safe": {
        "isSafe": true,
        "version": "1.4.1",
        "threshold": 1,
        "owners": ["0xb87C647a1a0857a4f96271F1d9846fd470e4ad62"],
        "controller": "1-of-1 signer EOA 0xb87C647a1a0857a4f96271F1d9846fd470e4ad62",
        "isOneOfOne": true
      },
      "allowedActions": [
        "own and manage the afidao.eth ENS namespace and its subname records",
        "act as admin of the afidao.eth Snapshot space (network 1)",
        "hold the ENS wrapped-name ERC-1155 tokens for the namespace"
      ],
      "forbiddenActions": [
        "custody protocol reward/treasury funds",
        "be wired as a RewardsVault or settlement custody",
        "be treated as the canonical on-chain treasury",
        "be resolved dynamically by contracts for access control"
      ],
      "knownMismatches": [
        "reserve.afidao.eth resolves to this SAME Safe (0x4b02) — 'reserve' is not a segregated vault",
        "holds 0 ETH and no value tokens; it is not a funded vault",
        "deployed on Ethereum mainnet only; not on Base"
      ],
      "source": "ENS live records (Ethereum mainnet) + reports/afi-ens-vault-registry-recon.md",
      "confidence": "high",
      "notes": "Safe v1.4.1 on Ethereum mainnet only. NameWrapper owner of the entire afidao.eth namespace and a Snapshot admin. 18 Safe txs during namespace setup (Nov 2025), dormant since. afidao.eth registration expires 2026-12-01 (renewal is an owner action).",
      "lastVerified": "2026-06-24",
      "requiresOwnerConfirmation": true
    },
    {
      "id": "reserve-afidao-eth",
      "name": "AFI Reserve (ENS alias)",
      "ens": "reserve.afidao.eth",
      "resolvedAddress": "0x4b02AC8E5551C30c4C92814F63D4576F335E4112",
      "chainId": 1,
      "network": "ethereum-mainnet",
      "accountType": "safe",
      "recommendedRole": "AFI_RESERVE_VAULT_PLACEHOLDER",
      "currentStatus": "placeholder",
      "productionStatus": "not-production",
      "isCanonical": false,
      "isPlaceholder": true,
      "isRuntimeAuthority": false,
      "isFundedVault": false,
      "safe": {
        "isSafe": true,
        "version": "1.4.1",
        "threshold": 1,
        "owners": ["0xb87C647a1a0857a4f96271F1d9846fd470e4ad62"],
        "controller": "1-of-1 signer EOA 0xb87C647a1a0857a4f96271F1d9846fd470e4ad62",
        "isOneOfOne": true
      },
      "allowedActions": [
        "reserve the 'reserve' identity for future use",
        "after owner approval, be re-pointed to a dedicated cold reserve Safe distinct from the admin key"
      ],
      "forbiddenActions": [
        "be treated as a segregated reserve while it equals the namespace-admin Safe",
        "hold reserves under a 1-of-1 hot signer",
        "be resolved dynamically by contracts for access control"
      ],
      "knownMismatches": [
        "COLLISION: resolves to 0x4b02 — identical to afidao.eth (root identity); it is not a segregated cold reserve today",
        "0 ETH; L1-only; no Base address record"
      ],
      "source": "ENS live records (Ethereum mainnet) + reports/afi-ens-vault-registry-recon.md",
      "confidence": "high",
      "notes": "Intended AFIReserveVault per AFI Settlement v1, but currently the same account as the root identity. Reserve segregation is an OPEN owner decision.",
      "lastVerified": "2026-06-24",
      "requiresOwnerConfirmation": true
    },
    {
      "id": "treasury-afidao-eth",
      "name": "AFI Treasury (ENS alias)",
      "ens": "treasury.afidao.eth",
      "resolvedAddress": "0x7408d8e97280e391A38DffE3AE8dF7E5c553438f",
      "chainId": 1,
      "network": "ethereum-mainnet",
      "accountType": "safe",
      "recommendedRole": "AFI_TREASURY_VAULT_PLACEHOLDER",
      "currentStatus": "placeholder",
      "productionStatus": "not-production",
      "isCanonical": false,
      "isPlaceholder": true,
      "isRuntimeAuthority": false,
      "isFundedVault": false,
      "safe": {
        "isSafe": true,
        "version": "1.4.1",
        "threshold": 1,
        "owners": ["0xb87C647a1a0857a4f96271F1d9846fd470e4ad62"],
        "controller": "1-of-1 signer EOA 0xb87C647a1a0857a4f96271F1d9846fd470e4ad62",
        "isOneOfOne": true
      },
      "allowedActions": [
        "reserve the 'treasury' identity for future use",
        "after owner approval, be re-pointed to the canonical Base Treasury Safe (see related account afi-base-treasury-safe) or to an L1 treasury Safe"
      ],
      "forbiddenActions": [
        "be treated as the real or production treasury",
        "receive funds before doctrine + signer policy are locked",
        "be assumed equal to the deployed AFI Base Treasury Safe 0x1Dd6705... (that Safe is on Base, not L1)",
        "be resolved dynamically by contracts for access control"
      ],
      "knownMismatches": [
        "NOT the real Base Treasury Safe (0x1Dd6705ff84Ecd5eaDc51A913Ad8e2c6C9E79aC4, Base) — see relatedAccounts.afi-base-treasury-safe",
        "empty L1 Safe: 0 ETH, ZERO executed transactions",
        "shares its address (0x7408) with grants/ops/liq.afidao.eth",
        "no Base (coinType) address record exists"
      ],
      "source": "ENS live records (Ethereum mainnet) + reports/afi-ens-vault-registry-recon.md",
      "confidence": "high",
      "notes": "Highest-confusion alias. Intended AFITreasuryVault, but currently an unused L1 placeholder Safe that is NOT the real treasury authority. Reconciliation with the Base Treasury Safe is an OPEN owner decision (see openQuestions OQ-1).",
      "lastVerified": "2026-06-24",
      "requiresOwnerConfirmation": true
    },
    {
      "id": "grants-afidao-eth",
      "name": "AFI Grants (ENS alias)",
      "ens": "grants.afidao.eth",
      "resolvedAddress": "0x7408d8e97280e391A38DffE3AE8dF7E5c553438f",
      "chainId": 1,
      "network": "ethereum-mainnet",
      "accountType": "safe",
      "recommendedRole": "AFI_GRANTS_VAULT_PLACEHOLDER",
      "currentStatus": "placeholder",
      "productionStatus": "not-production",
      "isCanonical": false,
      "isPlaceholder": true,
      "isRuntimeAuthority": false,
      "isFundedVault": false,
      "safe": {
        "isSafe": true,
        "version": "1.4.1",
        "threshold": 1,
        "owners": ["0xb87C647a1a0857a4f96271F1d9846fd470e4ad62"],
        "controller": "1-of-1 signer EOA 0xb87C647a1a0857a4f96271F1d9846fd470e4ad62",
        "isOneOfOne": true
      },
      "allowedActions": [
        "reserve the 'grants' identity for future use",
        "after owner approval, be re-pointed to a dedicated grants/program Safe"
      ],
      "forbiddenActions": [
        "share one address with treasury/ops/liq in a production registry",
        "receive grant funds before doctrine + signer policy are locked",
        "be resolved dynamically by contracts for access control"
      ],
      "knownMismatches": [
        "shares its address (0x7408) with treasury/ops/liq.afidao.eth — no lane segregation",
        "empty placeholder Safe: 0 ETH, 0 executed transactions",
        "no Base address record"
      ],
      "source": "ENS live records (Ethereum mainnet) + reports/afi-ens-vault-registry-recon.md",